[{"scenario_id":"dictionary-lookup-laws","mode":"lookup","cases":[{"dictionaries":[{"title":"TestDict","entries":[["読む","よむ",["to read"]],["本","ほん",["book"]]]}],"token":{"surface":"読む","lemma":"読む","reading":"よむ","pos":"動詞","start":0,"end":2,"pos2":""},"has_terms":["よむ","nope"],"observe":["titles","reading","definitions","has-terms"]},{"dictionaries":[{"title":"N","entries":[["箆","の",["shaft of an arrow"]],["の","の",["possessive particle"]]]}],"token":{"surface":"の","lemma":"の","reading":"の","pos":"助詞","start":0,"end":1,"pos2":""},"observe":["headword","definitions"]},{"dictionaries":[{"title":"H","entries":[["気","き",["spirit; mind"]],["木","き",["tree"]],["生","き",["raw"]]]}],"token":{"surface":"気","lemma":"気","reading":"き","pos":"名詞","start":0,"end":1,"pos2":""},"observe":["headword","definitions"]},{"dictionaries":[{"title":"K","entries":[["掛ける","かける",["to hang"]],["懸ける","かける",["to wager"]]]}],"token":{"surface":"かける","lemma":"かける","reading":"かける","pos":"動詞","start":0,"end":3,"pos2":""},"observe":["definitions"]},{"dictionaries":[{"title":"AAA","entries":[["猫","ねこ",["cat"]]]}],"token":{"surface":"読む","lemma":"読む","reading":"よむ","pos":"動詞","start":0,"end":2,"pos2":""},"observe":["definitions","default-card","cards"]},{"dictionaries":[{"title":"First","entries":[["行く","いく",["to go"]]]},{"title":"Second","entries":[["行く","ゆく",["to go (poetic)"]]]}],"token":{"surface":"行く","lemma":"行く","reading":"いく","pos":"動詞","start":0,"end":2,"pos2":""},"observe":["reading","definitions"]},{"dictionaries":[{"title":"Dict0","entries":[["猫","ねこ",["cat (0)"]]]},{"title":"Dict1","entries":[["猫","ねこ",["cat (1)"]]]},{"title":"Dict2","entries":[["猫","ねこ",["cat (2)"]]]},{"title":"Dict3","entries":[["猫","ねこ",["cat (3)"]]]}],"token":{"surface":"猫","lemma":"猫","reading":"ねこ","pos":"名詞","start":0,"end":1,"pos2":""},"observe":["definitions"]},{"dictionaries":[{"title":"TestDict","entries":[["読む","よむ",["to read","to peruse"]]]}],"token":{"surface":"読む","lemma":"読む","reading":"よむ","pos":"動詞","start":0,"end":2,"pos2":""},"observe":["default-card"]},{"dictionaries":[{"title":"Multi","entries":[["表","ひょう",["table"]],["表","おもて",["surface"]]]}],"frequencies":[{"title":"Freq","entries":[["表",{"reading":"おもて","frequency":500}],["表",{"reading":"ひょう","frequency":9000}]]}],"token":{"surface":"表","lemma":"表","reading":"","pos":"名詞","start":0,"end":1,"pos2":""},"observe":["default-card"]},{"dictionaries":[{"title":"Multi","entries":[["退く","しりぞく",["to retreat"]],["退く","のく",["to step aside"]]]}],"token":{"surface":"退いた","lemma":"退く","reading":"のいた","pos":"動詞","start":0,"end":3,"pos2":""},"observe":["reading","groups","cards","default-card"]},{"dictionaries":[{"title":"Phrase","entries":[["数ある","かずある",["many; numerous"]],["数","かず",["number"]]]}],"token":{"surface":"数","lemma":"数","reading":"かず","pos":"名詞","start":0,"end":1,"pos2":""},"extra_terms":["数ある"],"observe":["reading","groups","cards","default-card"]},{"dictionaries":[{"title":"Honorific","entries":[["お休み","おやすみ",["rest; good night"]],["休み","やすみ",["holiday"]]]}],"token":{"surface":"休み","lemma":"休む","reading":"やすみ","pos":"動詞","start":0,"end":2,"pos2":""},"extra_terms":["お休み"],"observe":["groups"]},{"dictionaries":[{"title":"One","entries":[["読む","よむ",["to read"]]]}],"token":{"surface":"読む","lemma":"読む","reading":"よむ","pos":"動詞","start":0,"end":2,"pos2":""},"observe":["groups"]},{"dictionaries":[{"title":"TestDict","entries":[["猫","ねこ",["cat"]]]}],"token":{"surface":"犬","lemma":"犬","reading":"いぬ","pos":"名詞","start":0,"end":1,"pos2":""},"observe":["cards","default-card"]}],"expect":[{"titles":["TestDict"],"reading":"よむ","definitions":[{"dictionary":"TestDict","content":["to read"]}],"has-terms":{"よむ":true,"nope":false}},{"headword":["の"],"definitions":[{"dictionary":"N","content":["possessive particle"]}]},{"headword":[{"tag":"ruby","content":["気",{"tag":"rt","content":"き"}]}],"definitions":[{"dictionary":"H","content":["spirit; mind"]}]},{"definitions":[{"dictionary":"K","content":["to hang","to wager"]}]},{"definitions":[{"dictionary":"—","content":["（辞書に見つかりませんでした）"]}],"default-card":{"expression":"読む","reading":"よむ","glosses":[],"glossary_html":""},"cards":[]},{"reading":"いく","definitions":[{"dictionary":"First","content":["to go"]},{"dictionary":"Second","content":["to go (poetic)"]}]},{"definitions":[{"dictionary":"Dict0","content":["cat (0)"]},{"dictionary":"Dict1","content":["cat (1)"]},{"dictionary":"Dict2","content":["cat (2)"]},{"dictionary":"Dict3","content":["cat (3)"]}]},{"default-card":{"expression":"読む","reading":"よむ","glosses":["to read","to peruse"],"glossary_html":"<ol><li>to read</li><li>to peruse</li></ol>"}},{"default-card":{"expression":"表","reading":"おもて","glosses":["surface"],"glossary_html":"<ol><li>surface</li></ol>"}},{"reading":"のく","groups":[{"reading":"のく","card_index":0,"definitions":[["to step aside"]]},{"reading":"しりぞく","card_index":1,"definitions":[["to retreat"]]}],"cards":[{"expression":"退く","reading":"のく","glosses":["to step aside"]},{"expression":"退く","reading":"しりぞく","glosses":["to retreat"]}],"default-card":{"expression":"退く","reading":"のく","glosses":["to step aside"],"glossary_html":"<ol><li>to step aside</li></ol>"}},{"reading":"かずある","groups":[{"reading":"かずある","card_index":0,"definitions":[["many; numerous"]]},{"reading":"かず","card_index":1,"definitions":[["number"]]}],"cards":[{"expression":"数ある","reading":"かずある","glosses":["many; numerous"]},{"expression":"数","reading":"かず","glosses":["number"]}],"default-card":{"expression":"数ある","reading":"かずある","glosses":["many; numerous"],"glossary_html":"<ol><li>many; numerous</li></ol>"}},{"groups":[{"reading":"おやすみ","card_index":0,"definitions":[["rest; good night"]]},{"reading":"やすみ","card_index":1,"definitions":[["holiday"]]}]},{"groups":[]},{"cards":[],"default-card":{"expression":"犬","reading":"いぬ","glosses":[],"glossary_html":""}}]}]
